{
  "id": 90211,
  "userId": "42",
  "conversationId": "conv-7f3a9c",
  "action": "tool_call",
  "detail": "create_followup_task({\"customerId\":17})",
  "actionKey": "audit.action.tool_call",
  "actionLabel": "调用工具 create_followup_task",
  "agentId": null,
  "parentActionId": null,
  "callerAgentId": null,
  "delegationContext": null,
  "businessIntent": "客户跟进",
  "source": "web",
  "ip": "203.0.113.7",
  "guestId": "guest-7f3a9c",
  "deviceId": "dev-11111111",
  "model": "deepseek-v4-flash",
  "provider": "deepseek",
  "promptTokens": 812,
  "completionTokens": 143,
  "durationMs": 2310,
  "isError": false,
  "errorMessage": null,
  "authorization": null,
  "feedback": null,
  "feedbackNote": null,
  "createdAt": "2026-09-11T09:12:55.000Z",
  "username": "alex",
  "businessEvent": "FollowupTaskCreated",
  "evidence": null
}
